{
  "schema_version": 1,
  "layout_profile": "pattern_b_compact_01_05",
  "revision_comment": "monthly-report-revision: tokura-v2-2026-05-13 — 十倉 未希（61630）Pattern B。payload によるテンプレ再現例（本文は monthly_2026-04_tokura_v2_report.html と同等）",

  "print_banner_html": "ご家庭へお送りする PDF を印刷するときは、この注意文と下の<strong>管理者向け</strong>の枠が印刷されないことをご確認ください（ブラウザの印刷プレビューで確認できます）。",

  "meta": {
    "page_title": "EDUBAL Academy 月次学習レポート（十倉 未希 様）",
    "logo_sub_html": "<br>",
    "report_id": "RPT-202604-61630",
    "issue_date_label": "2026年5月13日",
    "period_range_label": "2026年4月1日 ─ 4月30日",
    "report_title": "月次学習レポート",
    "title_period": "2026年4月の学習の様子と今後の予定",
    "copyright_year": "2026",
    "print_button_label": "印刷 / PDF保存（管理者欄は非表示）"
  },

  "greeting": {
    "honorific_lines": ["十倉 未希 様", "保護者の皆様"],
    "paragraphs": [
      "いつも二宮先生の指導を受けていただき、ありがとうございます。",
      "本レポートは、学習計画表と担当との打合せの内容をもとに、2026年4月の学習の様子と今後の予定を整理したものです。"
    ]
  },

  "sec01": {
    "student_code": "61630",
    "student_display_name": "十倉 未希 様",
    "teacher_display": "二宮（Runa Ninomiya）",
    "staff_contact": "藤井",
    "subject": "Math AA（SL）",
    "universities": "モナシュ大学マレーシア校、シンガポール経営大学",
    "ib_target": "35〜38/45",
    "ib_current": "7/7（計画表記載・要確認）",
    "mock_exam": "2027年",
    "final_exam": "2027年5月",
    "school_tests_heading": "学校のテスト状況",
    "school_tests_body_html": "Topic 4 の unit test と Topic 3 の unit test とで、ともに<strong>7</strong>を取得いたしました。設問レベルや満点との関係は、学校返却の答案でご確認ください。"
  },

  "sec02": {
    "good_points_label": "良い点・成長がみられる点",
    "highlight_paragraphs_html": [
      "<p><strong>Probability（Topic 4）の Unit test 2</strong> は<strong>満点（34／34）</strong>でした。</p>",
      "<p>基礎内容はしっかり理解できており、応用問題にも取り組める力がついてきています。詳しい単元の列挙は<strong>03 授業内容</strong>をご覧ください。</p>"
    ],
    "show_plan_policy_box": false,
    "plan_policy_label": "今後の計画方針（当塾）",
    "plan_policy_body_html": "",
    "mood_legend_html": "<strong>凡例：</strong>😊 良い　🙂 やや良い　😐 まずまず　😢 課題あり",
    "mood_table_heading": "今月の振り返りと次月の目標",
    "mood_col_eval_heading": "今月の学習状況と評価",
    "mood_col_goal_heading": "今月の振り返りと次月の目標",
    "mood_rows": [
      {
        "item": "学習進捗",
        "eval_cell_html": "<span class=\"mood-icon\" aria-hidden=\"true\">😊</span>良い",
        "goal_cell_html": "4月は Probability の unit test が満点、Calculus は chain／product から quotient・指数・対数の微分まで段階的に進みました。学校の Trigonometry のテストは<strong>7</strong>でした。当塾の先取りペースは順調で、学校の進みとのすり合わせを続けています。"
      },
      {
        "item": "学習意欲",
        "eval_cell_html": "<span class=\"mood-icon\" aria-hidden=\"true\">😊</span>良い",
        "goal_cell_html": "授業には積極的に取り組まれています。Section B などの難度の高い問題でも、解法の筋道を自分で見つけて進められる場面がみられ、応用力として大きな強みです。"
      },
      {
        "item": "宿題の提出",
        "eval_cell_html": "<span class=\"mood-icon\" aria-hidden=\"true\">😊</span>良い",
        "goal_cell_html": "宿題の提出は良好で、高い正答率がみられます。"
      }
    ]
  },

  "sec03": {
    "title_suffix": "（4月）",
    "lesson_rows": [
      {
        "date": "2026/04/02",
        "simple_cell_html": "Probability — Unit test 2",
        "rating": "★★★"
      },
      {
        "date": "2026/04/13",
        "unit_main": "Calculus",
        "unit_subtopics": "Limits／The gradient of a tangent／The derivative function／Simple rules of differentiation／The chain rule／The product rule（quotient は次回）",
        "rating": "★★☆"
      },
      {
        "date": "2026/04/30",
        "unit_main": "Calculus",
        "unit_subtopics": "The quotient rule／Derivatives of exponential functions／Derivatives of logarithmic functions（同日・学校の Trigonometry テストの確認／解説、2 コマ分を計画表に記載）",
        "rating": "★★☆"
      }
    ],
    "star_legend_html": "<b>理解度（★）の目安：<br></b><span style=\"font-size: 9pt;\">★☆☆＝基礎内容の定着が必要<br>★★☆＝基礎問題が解けるが応用問題に対応できない<br>★★★＝基礎に加え応用問題にも対応できている<br>※いずれも授業内の観察と演習の様子に基づきます。</span>"
  },

  "sec04": {
    "paragraphs_html": [
      "<p><strong>計算ミス</strong>（符号の取り違えなど）にご注意ください。自己採点の際に<strong>間違えた問題をマークスキームで確認</strong>し、どこで崩れたかを把握する習慣があると改善しやすくなります。</p>",
      "<p>differentiation と integration を混同しないよう、授業では概念と計算の過程を丁寧に扱っていきます。Calculus には<strong>logarithms・exponential・Trigonometry</strong>などの前提知識が欠かせないため、忘れずに復習をお願いします。6月22日頃までにカリキュラム範囲を終えてから<strong>本格的な過去問演習</strong>に入る想定です（試験時間は Paper 1 の 1.5 時間を意識）。</p>",
      "<p><strong>IA および EE は、mock が本格化する前に進めておく</strong>と試験に集中しやすくなります。学校での開始時期が分かり次第、ご連絡ください。</p>"
    ]
  },

  "sec05": {
    "paragraphs_html": [
      "<p>詳細な単元と日程は、<a href=\"https://docs.google.com/spreadsheets/d/1d0_0kj2C-kjgikWRGsorTw8wADYIk0Z4j59AwFDzaDo/edit?gid=116668180#gid=116668180\" target=\"_blank\" rel=\"noopener noreferrer\" title=\"学習計画表へ\">▶ 学習計画表</a>をご確認ください。</p>",
      "<p>5月以降も<strong>週1ペース</strong>での調整を基本としています。計画表では<strong>Derivatives of trigonometric functions</strong>、<strong>Tangents／Normals</strong>への展開も見込んでいます。学校の進捗に応じて<strong>演習中心</strong>か<strong>予習中心</strong>かを切り替えますので、担当より共有いたします。</p>"
    ],
    "family_asks_label": "今後の進め方・ご家庭へのお願い",
    "family_ask_bullets_html": [
      "学校の<strong>テスト日程</strong>や <strong>IA・EE のスケジュール</strong>が分かりましたら、当塾までお知らせください。",
      "必要に応じて、担当の藤井より学習計画の調整についてご連絡します。"
    ],
    "closing_html": "ご確認いただき、ご意見やご要望がありましたらお知らせいただけますと幸いです。<br>引き続きどうぞよろしくお願いいたします。"
  },

  "footer": {
    "contact_lines_html": "お問い合わせは担当教師・担当まで<br>\n（連絡先は運用に合わせて差し替え）"
  },

  "admin": {
    "heading": "【管理者・担当者向け】配布前チェック",
    "intro_html": "ご家庭へ送付する PDF では、本節が印刷されないことを確認してください。",
    "bullets_html": [
      "一次情報：<code>samples/reports/household_tokura/sources/_gws_student_A1-Z200_values.json</code>、<code>_gws_SL_lesson_plan_A1-M250_values.json</code>、<code>_gws_doc_teacher_MTG_gemini.json</code>（Gemini メモ）。配布前に<strong>音声・原記録</strong>と照合してください。",
      "Gemini メモ内の「クラ氏」等は誤記の可能性があります。本文は<strong>十倉 未希</strong>さん向けに整形済みです。",
      "01 の「現状スコア 7/7」は計画表の表記どおり。IB 総点か別指標か、答案で確定してください。",
      "二宮先生の表記（Runa Ninomiya）とスプレ表示名の整合を確認してください。",
      "HL 科目（Business 等）の記述は本レポートでは触れていません。必要なら <code>lesson plan</code> タブを別途反映してください。",
      "<strong>tokura_v2</strong>：家庭向け表記・<code>.unit-main</code>／<code>.unit-subtopics</code>・01 学校テスト要約など、<code>monthly_pattern_b_content.template.md</code>／スキル準拠版。計画表生メモとは学校テスト文言が異なる場合は原記録で確定すること。"
    ]
  }
}
